,chunkId,content,heading,StartPage,EndPage,ContentWordCount,pdfName,contentType,image,summary
0,1.0,## Nabard Farmer Producer Organisations Frequently Asked Questions (Faqs),,,,9,input/md/english\FARMER PRODUCER ORGANISATIONS.pdf,heading,,
1,2.0,# National Bank For Agriculture Mumbai 2015,,,,7,input/md/english\FARMER PRODUCER ORGANISATIONS.pdf,heading,,
2,3.0,"""The issue of profitability of small holding based agriculture has assumed importance in view of increasing proportion of small and marginal farmers in the country. I propose to supplement NABARD's Producers' organization development fund for Producer's development and upliftment called PRODUCE with a sum of Rs 200 crore which will be utilized for building 2,000 producers organizations across the country over the next two years."" Shri Arun Jaitley, Hon'ble Union Finance Minister, Govt. of India",National Bank For Agriculture Mumbai 2015,,,75,input/md/english\FARMER PRODUCER ORGANISATIONS.pdf,para,,
3,4.0,# And Rural Development,,,,4,input/md/english\FARMER PRODUCER ORGANISATIONS.pdf,heading,,
4,5.0,## Nabard'S Mission,And Rural Development,,,3,input/md/english\FARMER PRODUCER ORGANISATIONS.pdf,heading,,
5,6.0,"Promote sustainable and equitable  agriculture and rural prosperity through  effective credit support, related services,    institution development and other           innovative initiatives.","And Rural Development,Nabard'S Mission",,,20,input/md/english\FARMER PRODUCER ORGANISATIONS.pdf,para,,
6,7.0,# Farmer Producer Organisations Frequently Asked Questions (Faqs),,,,8,input/md/english\FARMER PRODUCER ORGANISATIONS.pdf,heading,,
7,,,Farmer Producer Organisations Frequently Asked Questions (Faqs),,,0,input/md/english\FARMER PRODUCER ORGANISATIONS.pdf,para,,
8,,"and Rural Development National Bank for Agriculture Mumbai  2015 Title                               :                                  Farmer Producer Organisations - Frequently Asked Questions (FAQs)   Written and Published by                               :                                  Farm Sector Policy Department & Farm Sector                                   Development Department, NABARD Head Office, Mumbai  Date of Publishing                               :                                  March 2015 Design & Printing                               :                                  M/s Image Impression Contact                               :                                  Plot No C-24, 'G' Block, Bandra Kurla Complex,                                  Bandra East, Mumbai - 400051.",Farmer Producer Organisations Frequently Asked Questions (Faqs),,,65,input/md/english\FARMER PRODUCER ORGANISATIONS.pdf,para,,
9,,India.,Farmer Producer Organisations Frequently Asked Questions (Faqs),,,1,input/md/english\FARMER PRODUCER ORGANISATIONS.pdf,para,,
10,,"                                 Tel: +91 22 26539843                                  Website: www.nabard.org, www.youtube.com/nabardonline    © 2015 National Bank for Agriculture and Rural Development Unless otherwise stated in this document, no part of this document may be reproduced or transmitted in any form by any means without the written authorization from NABARD.",Farmer Producer Organisations Frequently Asked Questions (Faqs),,,44,input/md/english\FARMER PRODUCER ORGANISATIONS.pdf,para,,
11,,"FOREWORD National Bank for Agriculture and Rural Development (NABARD) sincerely acknowledges the efforts of Shri K K Gupta, former Director, Bankers Institute of Rural Development (BIRD) Lucknow and his team of Faculty Members who have made significant contribution in bringing out this Manual on Farmer Producer Organizations.",Farmer Producer Organisations Frequently Asked Questions (Faqs),,,47,input/md/english\FARMER PRODUCER ORGANISATIONS.pdf,para,,
12,,Special thanks are due to Faculty Members of BIRD viz. Shri D.,Farmer Producer Organisations Frequently Asked Questions (Faqs),,,12,input/md/english\FARMER PRODUCER ORGANISATIONS.pdf,para,,
13,," Nageswara Rao (Coordinator), Shri U.D. Shirsalkar, Shri Jaideep Srivastava, Shri R.K. Srivastava, Shri Maheshwar Sahoo, Shri G.S. Rawat and Shri K.I. Shariff, for collating information from different sources and organizing various chapters in a sequential manner.",Farmer Producer Organisations Frequently Asked Questions (Faqs),,,36,input/md/english\FARMER PRODUCER ORGANISATIONS.pdf,para,,
14,,They have taken due care in drafting and editing the contents in a user friendly way.,Farmer Producer Organisations Frequently Asked Questions (Faqs),,,16,input/md/english\FARMER PRODUCER ORGANISATIONS.pdf,para,,
15,,"Shri Sunil Chawla, Joint Director, Dr. K.C. Sharma, Shri Niraj Kumar Verma and Shri KL Vinaya, Faculty Members of BIRD have also given their help in proof reading and improving the contents of the manual.",Farmer Producer Organisations Frequently Asked Questions (Faqs),,,35,input/md/english\FARMER PRODUCER ORGANISATIONS.pdf,para,,
16,,"The access to the material and information from earlier manuals and resources on the subject developed, *inter alia*, by Department of Agriculture and Cooperation (DAC) in Ministry of Agriculture, Govt.",Farmer Producer Organisations Frequently Asked Questions (Faqs),,,30,input/md/english\FARMER PRODUCER ORGANISATIONS.pdf,para,,
17,,"of India,  Small Farmers Agribusiness Consortium  (SFAC) as also Dr. Amar KJR Nayak, Professor of Management & Centre Director, National Centre for Sustainable Community Systems, Lal Bahadur Shastri National Academy of Administration, Mussoorie and Action for Social Advancement (ASA), Bhopal, is sincerely acknowledged.",Farmer Producer Organisations Frequently Asked Questions (Faqs),,,43,input/md/english\FARMER PRODUCER ORGANISATIONS.pdf,para,,
18,,"  Conceptualization and development of manual would not have been possible without the continued encouragement, support and guidance of Dr. Harsh Kumar Bhanwala, Chairman NABARD, Shri R Amalorpavanathan and Shri H R Dave, Deputy Managing Directors of NABARD.",Farmer Producer Organisations Frequently Asked Questions (Faqs),,,37,input/md/english\FARMER PRODUCER ORGANISATIONS.pdf,para,,
19,,"Also, the initiatives taken and efforts put in by Dr. P Radhakrishnan, Chief General Manager, Dr. A R Khan and Shri Sanjay Kumar Dora, Deputy General Managers in coordinating with BIRD and other organizations/ departments in bringing out this manual, are greatly acknowledged.",Farmer Producer Organisations Frequently Asked Questions (Faqs),,,43,input/md/english\FARMER PRODUCER ORGANISATIONS.pdf,para,,
20,,"Dr. B G Mukhopadhyay Chief General Manager Farm Sector Development Department NABARD Head Office, Mumbai     The Objective of this Manual is to act as a guide to Producer Organisation Promoting Institutions (POPIs) in Promoting and Capacity Building of Producer Organisations (POs) and help POs towards better Management and Business Development.",Farmer Producer Organisations Frequently Asked Questions (Faqs),,,50,input/md/english\FARMER PRODUCER ORGANISATIONS.pdf,para,,
21,9.0,## Contents,Farmer Producer Organisations Frequently Asked Questions (Faqs),,,2,input/md/english\FARMER PRODUCER ORGANISATIONS.pdf,heading,,
22,10.0,"| Chapters      | Particulars                                                | Page No.    |
|---------------|------------------------------------------------------------|-------------|
| 1             | Concept of Producer Organisation                           | 1           |
| 2             | Producer Organisation Registered as Cooperative Society    | 15          |
| 3             | Producer Organisation Registered as Producer Company       | 19          |
| 4             | Producer Organisation Registered as Non-Profit Society     | 33          |
| 5             | Producer Organisation Registered as Trust                  | 36          |
| 6             | Producer Organisation Registered as Section 8 Company      | 39          |
| 7             | Business Planning                                          | 42          |
| 8             | Financial Management                                       | 55          |
| 9             | Funding Arrangement                                        | 60          |
| 10            | Monitoring by the PO, POPI and Funding Agencies            | 80          |
| Attachment    |                                                            |             |
| 1             | Producer Company Act provisions                            |             |
| 2             | PRODUCE Fund Operational Guidelines                        | 106         |
| 3             | SFAC Circular on Promoting / supporting Producer Companies | 114         |
| 4             | Case Study on Bilaspur Model of PO                         | 125         |
| 5             | Indicative Framework of the process of forming a PO        | 131         |
| 6             | References                                                 | 138         |
| 7             | Memorandum of Agreement between NABARD and POPI            | 139         |
| 8             | Memorandum of Understanding between NABARD and RSA         | 143         |
| 9             |                                                            |             |
| Abbreviations |                                                            |             |
|               |                                                            |             |
| 146           |                                                            |             |
|               |                                                            |             |
|               |                                                            |             |
|               |                                                            |             |
|               |                                                            |             |
|               |                                                            |             |
|               |                                                            |             |
|               |                                                            |             |
|               |                                                            |             |
|               |                                                            |             |
|               |                                                            |             |
|               |                                                            |             |
|               |                                                            |             |","Farmer Producer Organisations Frequently Asked Questions (Faqs),Contents",,,139,input/md/english\FARMER PRODUCER ORGANISATIONS.pdf,table,,
23,11.0,## Chapter 1 Concept Of Producer Organisation 1.1 What Is A Producer Organisation (Po)?,Farmer Producer Organisations Frequently Asked Questions (Faqs),,,14,input/md/english\FARMER PRODUCER ORGANISATIONS.pdf,heading,,
24,,"A Producer Organisation (PO) is a legal entity formed by primary producers, viz. farmers, milk producers, fishermen, weavers, rural artisans, craftsmen.","Farmer Producer Organisations Frequently Asked Questions (Faqs),Chapter 1 Concept Of Producer Organisation 1.1 What Is A Producer Organisation (Po)?",,,21,input/md/english\FARMER PRODUCER ORGANISATIONS.pdf,para,,
25,,"A PO can be a producer company, a cooperative society or any other legal form which provides for sharing of profits/benefits among the members.","Farmer Producer Organisations Frequently Asked Questions (Faqs),Chapter 1 Concept Of Producer Organisation 1.1 What Is A Producer Organisation (Po)?",,,24,input/md/english\FARMER PRODUCER ORGANISATIONS.pdf,para,,
26,,"In some forms like producer companies, institutions of primary producers can also become member of PO. 1.2  What is the need for PO?","Farmer Producer Organisations Frequently Asked Questions (Faqs),Chapter 1 Concept Of Producer Organisation 1.1 What Is A Producer Organisation (Po)?",,,23,input/md/english\FARMER PRODUCER ORGANISATIONS.pdf,para,,
27,, The main aim of PO is to ensure better income for the producers through an organization of their own.,"Farmer Producer Organisations Frequently Asked Questions (Faqs),Chapter 1 Concept Of Producer Organisation 1.1 What Is A Producer Organisation (Po)?",,,19,input/md/english\FARMER PRODUCER ORGANISATIONS.pdf,para,,
28,, Small producers do not have the volume individually (both inputs and produce) to get the benefit of economies of scale.,"Farmer Producer Organisations Frequently Asked Questions (Faqs),Chapter 1 Concept Of Producer Organisation 1.1 What Is A Producer Organisation (Po)?",,,20,input/md/english\FARMER PRODUCER ORGANISATIONS.pdf,para,,
29,,"Besides, in agricultural marketing, there is a long chain of intermediaries who very often work non-transparently leading to the situation where the producer receives only a small part of the value that the ultimate consumer pays.","Farmer Producer Organisations Frequently Asked Questions (Faqs),Chapter 1 Concept Of Producer Organisation 1.1 What Is A Producer Organisation (Po)?",,,36,input/md/english\FARMER PRODUCER ORGANISATIONS.pdf,para,,
30,,"Through aggregation, the primary producers can avail the benefit of economies of scale. They will also have better bargaining power vis-à-vis the bulk buyers of produce and bulk suppliers of inputs.","Farmer Producer Organisations Frequently Asked Questions (Faqs),Chapter 1 Concept Of Producer Organisation 1.1 What Is A Producer Organisation (Po)?",,,31,input/md/english\FARMER PRODUCER ORGANISATIONS.pdf,para,,
31,,"1.3  What is a ""Farmers Producer Organisation"" (FPO)?  It is one type of PO where the members are farmers.","Farmer Producer Organisations Frequently Asked Questions (Faqs),Chapter 1 Concept Of Producer Organisation 1.1 What Is A Producer Organisation (Po)?",,,19,input/md/english\FARMER PRODUCER ORGANISATIONS.pdf,para,,
32,,"Small Farmers' Agribusiness Consortium (SFAC) is providing support for promotion of FPOs. PO is a generic name for an organization of producers of any produce, e.g., agricultural, non-farm products, artisan products, etc.","Farmer Producer Organisations Frequently Asked Questions (Faqs),Chapter 1 Concept Of Producer Organisation 1.1 What Is A Producer Organisation (Po)?",,,32,input/md/english\FARMER PRODUCER ORGANISATIONS.pdf,para,,
33,,1.4  Can there be a PO for non-farmers?  Yes. The PO is an organization of the primary producers.,"Farmer Producer Organisations Frequently Asked Questions (Faqs),Chapter 1 Concept Of Producer Organisation 1.1 What Is A Producer Organisation (Po)?",,,18,input/md/english\FARMER PRODUCER ORGANISATIONS.pdf,para,,
34,,"If the produce in question is a nonfarm item (for example, handloom or handicraft), then the PO will be that of non-farmers.","Farmer Producer Organisations Frequently Asked Questions (Faqs),Chapter 1 Concept Of Producer Organisation 1.1 What Is A Producer Organisation (Po)?",,,22,input/md/english\FARMER PRODUCER ORGANISATIONS.pdf,para,,
35,,"The objective of the PO is to ensure better income realization to its members (who are producers) through aggregation and, if feasible, value addition. 1.5  What are the essential features of a PO?","Farmer Producer Organisations Frequently Asked Questions (Faqs),Chapter 1 Concept Of Producer Organisation 1.1 What Is A Producer Organisation (Po)?",,,33,input/md/english\FARMER PRODUCER ORGANISATIONS.pdf,para,,
36,, a. It is formed by a group of producers for either farm or non-farm activities. b. It is a registered body and a legal entity. c. Producers are shareholders in the organization. d.,"Farmer Producer Organisations Frequently Asked Questions (Faqs),Chapter 1 Concept Of Producer Organisation 1.1 What Is A Producer Organisation (Po)?",,,33,input/md/english\FARMER PRODUCER ORGANISATIONS.pdf,para,,
37,,It deals with business activities related to the primary produce/product. e. It works for the benefit of the member producers. f. A part of the profit is shared amongst the producers. g.,"Farmer Producer Organisations Frequently Asked Questions (Faqs),Chapter 1 Concept Of Producer Organisation 1.1 What Is A Producer Organisation (Po)?",,,32,input/md/english\FARMER PRODUCER ORGANISATIONS.pdf,para,,
38,,Rest of the surplus is added to its owned funds for business expansion.,"Farmer Producer Organisations Frequently Asked Questions (Faqs),Chapter 1 Concept Of Producer Organisation 1.1 What Is A Producer Organisation (Po)?",,,13,input/md/english\FARMER PRODUCER ORGANISATIONS.pdf,para,,
39,13.0,## 1.6 Who Owns The Po?,Farmer Producer Organisations Frequently Asked Questions (Faqs),,,6,input/md/english\FARMER PRODUCER ORGANISATIONS.pdf,heading,,
40,14.0,"The ownership of the PO is with its members. It is an organization of the producers, by the producers and for the producers. One or more institutions and/or individuals may have promoted the PO by way of assisting in mobilization, registration, business planning and operations. However, ownership control is always with members and management is through the representatives of the members.","Farmer Producer Organisations Frequently Asked Questions (Faqs),1.6 Who Owns The Po?",,,61,input/md/english\FARMER PRODUCER ORGANISATIONS.pdf,para,,
41,15.0,## 1.7 Who Can Promote A Po?,Farmer Producer Organisations Frequently Asked Questions (Faqs),,,7,input/md/english\FARMER PRODUCER ORGANISATIONS.pdf,heading,,
42,16.0,"Any individual or institution can promote a PO. Individual persons or institutions may promote PO using their own resources out of goodwill or with the noble objective of socioeconomic development of producers. If, however, the facilitating agency wishes to seek financial and other support, then they have to meet the requirements of the donor/financing agency. 1.8  Who provides support for promotion of PO?  NABARD, SFAC, Government Departments, Corporates and Domestic & International Aid Agencies provide financial and/or technical support to the Producer Organisation Promoting Institution (POPI) for promotion and hand-holding of the PO. Each agency has its own criteria for selecting the project/promoting institution to support. 1.9  Can an NGO promote PO?","Farmer Producer Organisations Frequently Asked Questions (Faqs),1.7 Who Can Promote A Po?",,,112,input/md/english\FARMER PRODUCER ORGANISATIONS.pdf,para,,
43,17.0,"## Yes, It Can. The Ngo May Be A Non-Profit Organization, But Not The Po. The Ngo Can Promote Po Which Will Provide Better Income To The Members. Sharing Of Profit Among Members Is An Important Objective Of The Po. 1.10 What Are The Different Legal Forms Of Po?",Farmer Producer Organisations Frequently Asked Questions (Faqs),,,49,input/md/english\FARMER PRODUCER ORGANISATIONS.pdf,heading,,
44,18.0,"Producer Organisation can be registered under any of the following legal provisions:  a. Cooperative Societies Act/ Autonomous or Mutually Aided Cooperative Societies Act  of the respective State  b. Multi-State Cooperative Society Act, 2002 c. Producer Company under Section 581(C) of Indian Companies Act, 1956, as amended  in 2013  d. Section 25 Company of Indian Companies Act, 1956, as amended as Section 8 in 2013 e. Societies registered under Society Registration Act, 1860 f. Public Trusts registered under Indian Trusts Act, 1882","Farmer Producer Organisations Frequently Asked Questions (Faqs),Yes, It Can. The Ngo May Be A Non-Profit Organization, But Not The Po. The Ngo Can Promote Po Which Will Provide Better Income To The Members. Sharing Of Profit Among Members Is An Important Objective Of The Po. 1.10 What Are The Different Legal Forms Of Po?",,,81,input/md/english\FARMER PRODUCER ORGANISATIONS.pdf,para,,
45,19.0,## 1.11 Which Legal Form Is Preferable For A Po?,Farmer Producer Organisations Frequently Asked Questions (Faqs),,,10,input/md/english\FARMER PRODUCER ORGANISATIONS.pdf,heading,,
46,20.0,"Institutions registered as cooperative societies and producer companies have legal provisions for sharing of profit earned by the PO by way of dividend. Other legal forms do not explicitly provide for profit sharing. However, the PO can offer better price for the produce it procures from the members, thus, benefiting the latter. Similarly, it can procure inputs/raw material in bulk and sell to members with low margin. Such activities are permissible for POs under all legal forms. A comparative chart of important features of Cooperative Society and Producer Company is given below:  Key differences between Producer Companies and Cooperative Societies","Farmer Producer Organisations Frequently Asked Questions (Faqs),1.11 Which Legal Form Is Preferable For A Po?",,,100,input/md/english\FARMER PRODUCER ORGANISATIONS.pdf,para,,
47,21.0,"| PARAMETER                               | COOPERATIVE SOCIETY   |              |
|-----------------------------------------|-----------------------|--------------|
| Registration  Cooperative Societies Act | Indian Companies Act  |              |
| Objectives                              | Single object         | Multi-object |
| Restricted, discretionary               | Entire Union of India | Area of      |
| Operation                               |                       |              |","Farmer Producer Organisations Frequently Asked Questions (Faqs),1.11 Which Legal Form Is Preferable For A Po?",,,24,input/md/english\FARMER PRODUCER ORGANISATIONS.pdf,table,,
48,22.0,##,Farmer Producer Organisations Frequently Asked Questions (Faqs),,,1,input/md/english\FARMER PRODUCER ORGANISATIONS.pdf,heading,,
