,chunkId,content,heading,StartPage,EndPage,ContentWordCount,pdfName,contentType,image,summary
425,220.0,"Section 8 Companies are those companies which are formed for the sole purpose of promoting commerce, art, science, religion, charity or any other useful object.   a. These types of companies can be either public company or private company having a  limited liability.   b. Profits earned by these companies can only be applied for promoting its objects and  cannot be distributed as dividend among its members.  c. These companies can be formed with or without share capital.  In case they are formed  without capital, the necessary funds for carrying the business are brought in the form of donations, subscriptions from members and general public.","Farmer Producer Organisations Frequently Asked Questions (Faqs),Chapter 6 Producer Organisation Registered As Section 8 Of The Companies Act, 2013 6.1 What Is A Section 8 Company?",,,103,input/md/english\FARMER PRODUCER ORGANISATIONS.pdf,para,,
426,221.0,## 6.2 What Advantages Do The Producers Organisations Get On Registering Themselves As Section 8 Companies?,Farmer Producer Organisations Frequently Asked Questions (Faqs),,,16,input/md/english\FARMER PRODUCER ORGANISATIONS.pdf,heading,,
427,222.0,"Section 8 Company is preferred as compared to Trust, society because of following reasons:  a. Section 8 Company has uniform law across the country. b. Section 8 Companies are also preferred, as compared to others, in foreign funding  because of stringent disclosure norms and regulatory provisions under Companies Act, 1956 and Foreign Contribution Regulation Act.    c. The Central and State Governments recognised Section 8 Company in various Schemes  implemented by them.   d. A wide range of activities can be taken up. e. Exempted from using the word Private Limited or Limited f. Members/Owners easily transfer ownership in shares and interest by the manner  provided by the Article of Association.   g. The continuation of an incorporated Section 8 Company is unaffected by the death of  any of its owner(s) or the transfer of its shares to a new entity/person","Farmer Producer Organisations Frequently Asked Questions (Faqs),6.2 What Advantages Do The Producers Organisations Get On Registering Themselves As Section 8 Companies?",,,138,input/md/english\FARMER PRODUCER ORGANISATIONS.pdf,para,,
428,223.0,## 6.3 What Are The Disadvantages Of A Section 8 Company?,Farmer Producer Organisations Frequently Asked Questions (Faqs),,,11,input/md/english\FARMER PRODUCER ORGANISATIONS.pdf,heading,,
429,224.0,"The followings are the disadvantages of Section 8 Company:-  a. Profits cannot be distributed as dividends to members and it will be applied for  promoting its objects only.   b. Alteration in the objects clause of the Company requires prior approval of Central  Government.   c. In comparison to Society and Trust, registration of Section 8 Company and complying  with other terms & conditions are costly.  Also, if there is any breach of law, a Section 8 Company has to bear penalties and fines.    d. Section 8 Companies also fall under the definition of Company under Income tax.  Therefore, same rate of tax is applicable to Section 8 Companies which is applicable to the normal profit making company.   e. Generally, complete closure or winding of Section 8 Companies takes around 1-2 years  and involves compliance of various formalities. Moreover, in certain cases, it requires the approval from the High Court.","Farmer Producer Organisations Frequently Asked Questions (Faqs),6.3 What Are The Disadvantages Of A Section 8 Company?",,,148,input/md/english\FARMER PRODUCER ORGANISATIONS.pdf,para,,
430,225.0,## 6.4 What Are The Essential Conditions For Po To Get Registered As Section 8 Company?,Farmer Producer Organisations Frequently Asked Questions (Faqs),,,16,input/md/english\FARMER PRODUCER ORGANISATIONS.pdf,heading,,
431,226.0,"For registration of Section 8 Company, the following conditions must be fulfilled:-  a. Minimum 2 Shareholders (for Private Limited Co.) and 7 Shareholders (for Public  Limited Co.)  b. Minimum 2 Directors (for Private Limited Co.) and 3 Directors (for Public Limited Co.)  c. DIN (Director Identification Number) is required for every director. d. At least one Director of the PO should obtain Digital Signature. e. Memorandum of Association f. Articles of Association","Farmer Producer Organisations Frequently Asked Questions (Faqs),6.4 What Are The Essential Conditions For Po To Get Registered As Section 8 Company?",,,72,input/md/english\FARMER PRODUCER ORGANISATIONS.pdf,para,,
432,227.0,## 6.5 What Documents Are Required To Be Filed For Obtaining Certificate Of Commencement As A Company?,Farmer Producer Organisations Frequently Asked Questions (Faqs),,,17,input/md/english\FARMER PRODUCER ORGANISATIONS.pdf,heading,,
433,228.0,"For Grant of License the following documents are also required:-  a. Three Copies of Memorandum of Association and Articles of Association b. Three Copies of list of names, descriptions, addresses of promoters/directors c. Three Copies of Statement showing estimates of future income and expenditure d. Three Copies of Statement giving in brief description of work done or proposed to be  carried out after incorporation  e. Three Copies of Statement specifying the grounds on which the application is made f. Declarations by all the directors of the company as per the prescribed proforma g. Declaration by Chartered Accountant or advocate of Supreme Court or of a High Court,  an attorney or pleader entitled to appear before High Court or a Company Secretary that the Memorandum & Articles of Association have been drawn up in accordance with the provisions of the Act.  h. Documentary Evidence in support of addresses of promoters i. All due diligence documents shall be notarized/attested by a gazetted officer or  CA/CS/CWA","Farmer Producer Organisations Frequently Asked Questions (Faqs),6.5 What Documents Are Required To Be Filed For Obtaining Certificate Of Commencement As A Company?",,,163,input/md/english\FARMER PRODUCER ORGANISATIONS.pdf,para,,
434,229.0,## 6.6 What Is Director Identification Number (Din)?,Farmer Producer Organisations Frequently Asked Questions (Faqs),,,8,input/md/english\FARMER PRODUCER ORGANISATIONS.pdf,heading,,
435,230.0,"Any individual who intends to become a Director of a company shall have Director Identification Number (DIN) which is mandatory for e-filing of forms and documents with the Registrar of Companies and PAN cannot be used as an alternative to DIN. DIN is also mandatory for directors of Indian companies who are not citizens of India. But, DIN is not mandatory for directors of foreign company having branch offices in India. Further, only a single DIN is required for an individual, irrespective of the number of directorship held by him/her. Documents and information required for getting DIN (Director Identification Number) of Director:-  a. Self-attested PAN Card of Director b. Self-attested address proof of Director  c. Affidavit d. Self-attested colour photo of Director e. e-mail id of Director f. Mobile No. of Director  g. Educational qualification of Director h. Current occupation of Director","Farmer Producer Organisations Frequently Asked Questions (Faqs),6.6 What Is Director Identification Number (Din)?",,,142,input/md/english\FARMER PRODUCER ORGANISATIONS.pdf,para,,
436,231.0,## 6.7 What Is A Digital Signature Or A Digital Signature Certificate?,Farmer Producer Organisations Frequently Asked Questions (Faqs),,,12,input/md/english\FARMER PRODUCER ORGANISATIONS.pdf,heading,,
437,232.0,"Physical documents are signed manually. Similarly, electronic documents, for example eforms, are required to be signed digitally using a Digital Signature Certificate. Documents required for getting Digital Signature or Digital Signature Certificate are as follows:-  a. Self-attested PAN Card of Director b. Self-attested address proof of Director c. One colour photo","Farmer Producer Organisations Frequently Asked Questions (Faqs),6.7 What Is A Digital Signature Or A Digital Signature Certificate?",,,51,input/md/english\FARMER PRODUCER ORGANISATIONS.pdf,para,,
438,233.0,## 6.8 What Is Memorandum Of Association Of A Producer Company?,Farmer Producer Organisations Frequently Asked Questions (Faqs),,,11,input/md/english\FARMER PRODUCER ORGANISATIONS.pdf,heading,,
439,234.0,"Memorandum of Association is a Charter document by which a company is registered. It contains the name of the company, state in which registered office of the company is situated, objects of the Company, authorised capital and capital subscribed by the shareholders of the Company.","Farmer Producer Organisations Frequently Asked Questions (Faqs),6.8 What Is Memorandum Of Association Of A Producer Company?",,,45,input/md/english\FARMER PRODUCER ORGANISATIONS.pdf,para,,
440,235.0,## 6.9 What Is Article Of Association Of A Producer Company?,Farmer Producer Organisations Frequently Asked Questions (Faqs),,,11,input/md/english\FARMER PRODUCER ORGANISATIONS.pdf,heading,,
441,236.0,Article of Association is the bye laws for the internal management of a company and defines the relationship between members and directors.,"Farmer Producer Organisations Frequently Asked Questions (Faqs),6.9 What Is Article Of Association Of A Producer Company?",,,22,input/md/english\FARMER PRODUCER ORGANISATIONS.pdf,para,,
442,237.0,## 6.10 What Is The Registered Office Of A Producer Company?,Farmer Producer Organisations Frequently Asked Questions (Faqs),,,11,input/md/english\FARMER PRODUCER ORGANISATIONS.pdf,heading,,
443,238.0,"Registered office is the principal place of business and is used for all official communication of the company. The registered office does not have to be necessarily owned by the company, it may be in a rented premises. Also, a company can change its registered office any time after following specific procedures as mentioned in the Companies Act, 1956 within the same state or in a different state from the state in which it was originally registered.","Farmer Producer Organisations Frequently Asked Questions (Faqs),6.10 What Is The Registered Office Of A Producer Company?",,,77,input/md/english\FARMER PRODUCER ORGANISATIONS.pdf,para,,
444,239.0,## 6.11 After Registering A Producer Organisation As Section 8 Company Whether Any More Registrations Are Required?,Farmer Producer Organisations Frequently Asked Questions (Faqs),,,17,input/md/english\FARMER PRODUCER ORGANISATIONS.pdf,heading,,
445,240.0,"If a Section 8 Company gets registered under section 12A and 80G of Income Tax Act, it enjoys the following benefits:-  a. Registration under Section 12A of Income Tax Act:- Income of Section 8 Company is  exempt if it is registered under Section 12A of Income Tax Act. This is a one-time registration.   b. Registration under Section 80G of Income Tax Act: Donors can claim tax deductions  for donations to the Producer Organisation, if it is registered under Section 80G of Income Tax Act. This needs to be renewed after expiry of the validity period. Note:  Please refer to the Companies Act 1956 and Companies Act 2013 and also the notifications, thereof.","Farmer Producer Organisations Frequently Asked Questions (Faqs),6.11 After Registering A Producer Organisation As Section 8 Company Whether Any More Registrations Are Required?",,,112,input/md/english\FARMER PRODUCER ORGANISATIONS.pdf,para,,
446,241.0,## Chapter 7 Business Planning,Farmer Producer Organisations Frequently Asked Questions (Faqs),,,5,input/md/english\FARMER PRODUCER ORGANISATIONS.pdf,heading,,
447,,7.1 What is the concept of value chain development?,"Farmer Producer Organisations Frequently Asked Questions (Faqs),Chapter 7 Business Planning",,,9,input/md/english\FARMER PRODUCER ORGANISATIONS.pdf,para,,
448,," Value chain comprises all the activities at different yet interlinked stages that add value to a particular product through the different phases of production, including procurement of raw materials and other inputs.","Farmer Producer Organisations Frequently Asked Questions (Faqs),Chapter 7 Business Planning",,,32,input/md/english\FARMER PRODUCER ORGANISATIONS.pdf,para,,
449,,"Usually, there are many actors along the value chain for producing, transforming/processing and bringing goods and services to end-consumers through a series of sequential activities.","Farmer Producer Organisations Frequently Asked Questions (Faqs),Chapter 7 Business Planning",,,25,input/md/english\FARMER PRODUCER ORGANISATIONS.pdf,para,,
450,,"When the produce originates from agriculture, we call it an agricultural value chain. Let us take the case of milk.","Farmer Producer Organisations Frequently Asked Questions (Faqs),Chapter 7 Business Planning",,,20,input/md/english\FARMER PRODUCER ORGANISATIONS.pdf,para,,
451,,"For producing milk, the farmer requires milch cattle, feed and fodder and shed for the cattle.","Farmer Producer Organisations Frequently Asked Questions (Faqs),Chapter 7 Business Planning",,,16,input/md/english\FARMER PRODUCER ORGANISATIONS.pdf,para,,
452,,"After milking (once/twice a day), the milk is taken to the collection centre where the volume, fat and SNF contents are measured.","Farmer Producer Organisations Frequently Asked Questions (Faqs),Chapter 7 Business Planning",,,22,input/md/english\FARMER PRODUCER ORGANISATIONS.pdf,para,,
453,,"From the collection centre, milk is transported to the Bulk Milk Chilling Unit, where the milk is filtered and chilled to keep it fresh.","Farmer Producer Organisations Frequently Asked Questions (Faqs),Chapter 7 Business Planning",,,24,input/md/english\FARMER PRODUCER ORGANISATIONS.pdf,para,,
454,,"From there, it goes to Milk Processing Plant, where bacteria is de-activated through pasteurization, and different types of milk and milk products are made.","Farmer Producer Organisations Frequently Asked Questions (Faqs),Chapter 7 Business Planning",,,24,input/md/english\FARMER PRODUCER ORGANISATIONS.pdf,para,,
455,,"Liquid milk (whole milk, toned milk, vitamin-A fortified milk) is made into packets and sent to wholesalers.","Farmer Producer Organisations Frequently Asked Questions (Faqs),Chapter 7 Business Planning",,,17,input/md/english\FARMER PRODUCER ORGANISATIONS.pdf,para,,
456,,The retailers get milk packets from the wholesalers and sell to the consumers through milk booth and/or through door delivery.,"Farmer Producer Organisations Frequently Asked Questions (Faqs),Chapter 7 Business Planning",,,20,input/md/english\FARMER PRODUCER ORGANISATIONS.pdf,para,,
457,,"Processed milk products like butter, curd, cheese, ghee etc., also reach the end-consumers from the processing facility thorough the same channel.","Farmer Producer Organisations Frequently Asked Questions (Faqs),Chapter 7 Business Planning",,,21,input/md/english\FARMER PRODUCER ORGANISATIONS.pdf,para,,
458,,The whole chain from purchasing of milch cattle to delivery of milk packets to consumers is the value chain for milk.,"Farmer Producer Organisations Frequently Asked Questions (Faqs),Chapter 7 Business Planning",,,21,input/md/english\FARMER PRODUCER ORGANISATIONS.pdf,para,,
459,,"Though value is added at each stage, major addition takes place through Milk Chilling, Pasteurisation and Processing.","Farmer Producer Organisations Frequently Asked Questions (Faqs),Chapter 7 Business Planning",,,17,input/md/english\FARMER PRODUCER ORGANISATIONS.pdf,para,,
460,,All the persons/agencies undertaking one or more activities in this chain are called the actors in the value chain.,"Farmer Producer Organisations Frequently Asked Questions (Faqs),Chapter 7 Business Planning",,,19,input/md/english\FARMER PRODUCER ORGANISATIONS.pdf,para,,
461,243.0,##,Farmer Producer Organisations Frequently Asked Questions (Faqs),,,1,input/md/english\FARMER PRODUCER ORGANISATIONS.pdf,heading,,
462,244.0,"7.2 What is value chain intervention?  The PO may choose to undertake any one or more than one activity of the value chain. In the example above, the PO may manufacture/procure concentrate feed and supply it to the farmers. It can purchase milch cattle in bulk from outside the state for the members. It can establish Bulk Milk Chilling Unit or Milk Processing Plant. It can purchase refrigerated vans for transport of milk and milk products.  It can establish milk parlours to sell milk and milk products to the end-consumers. Any such activity will be a value chain intervention. The key is to choose the intervention where the value-addition (and therefore the margin) is high, and which can be effectively managed by the PO keeping in view competition in the market.","Farmer Producer Organisations Frequently Asked Questions (Faqs),",,,131,input/md/english\FARMER PRODUCER ORGANISATIONS.pdf,para,,
463,245.0,"## 7.3 What Is The Benefit From Value Chain Concept? The Benefits May Be In Terms Of Pricing, Both For Input Supply, Output Delivery And Services. In Agricultural Value Chains, Benefits May Come From The Following, Which Would Result In Cost Reduction Or Revenue Maximisation",Farmer Producer Organisations Frequently Asked Questions (Faqs),,,45,input/md/english\FARMER PRODUCER ORGANISATIONS.pdf,heading,,
464,,"a. Business Processes: Aggregation, segregation and logistics b. Productivity: Man, material, money, input and output c. Warehousing: Space, costs and logistics d. Processing : Own  vs.","Farmer Producer Organisations Frequently Asked Questions (Faqs),7.3 What Is The Benefit From Value Chain Concept? The Benefits May Be In Terms Of Pricing, Both For Input Supply, Output Delivery And Services. In Agricultural Value Chains, Benefits May Come From The Following, Which Would Result In Cost Reduction Or Revenue Maximisation",,,26,input/md/english\FARMER PRODUCER ORGANISATIONS.pdf,para,,
465,,out-source     e. Products: Whole foods to  processed foods and to derivatives f. Risk mitigation    7.4 What is a business plan?,"Farmer Producer Organisations Frequently Asked Questions (Faqs),7.3 What Is The Benefit From Value Chain Concept? The Benefits May Be In Terms Of Pricing, Both For Input Supply, Output Delivery And Services. In Agricultural Value Chains, Benefits May Come From The Following, Which Would Result In Cost Reduction Or Revenue Maximisation",,,20,input/md/english\FARMER PRODUCER ORGANISATIONS.pdf,para,,
466,,"Business plan is a succinct document that specifies the components of a strategy with regard to the business mission, external and internal environments and problems identified in earlier analysis.","Farmer Producer Organisations Frequently Asked Questions (Faqs),7.3 What Is The Benefit From Value Chain Concept? The Benefits May Be In Terms Of Pricing, Both For Input Supply, Output Delivery And Services. In Agricultural Value Chains, Benefits May Come From The Following, Which Would Result In Cost Reduction Or Revenue Maximisation",,,29,input/md/english\FARMER PRODUCER ORGANISATIONS.pdf,para,,
467,,A business plan is not written each time a modification to a strategy is made. It should be written when a new venture is developed or a major new initiative is launched.,"Farmer Producer Organisations Frequently Asked Questions (Faqs),7.3 What Is The Benefit From Value Chain Concept? The Benefits May Be In Terms Of Pricing, Both For Input Supply, Output Delivery And Services. In Agricultural Value Chains, Benefits May Come From The Following, Which Would Result In Cost Reduction Or Revenue Maximisation",,,32,input/md/english\FARMER PRODUCER ORGANISATIONS.pdf,para,,
468,,"Sincere contemplation is needed about the business concept, the business opportunity, the competitive landscape, the essential elements for success, and the people who will be involved.","Farmer Producer Organisations Frequently Asked Questions (Faqs),7.3 What Is The Benefit From Value Chain Concept? The Benefits May Be In Terms Of Pricing, Both For Input Supply, Output Delivery And Services. In Agricultural Value Chains, Benefits May Come From The Following, Which Would Result In Cost Reduction Or Revenue Maximisation",,,26,input/md/english\FARMER PRODUCER ORGANISATIONS.pdf,para,,
469,,"The exercise will often lead to more questions, and these new questions must be properly researched to gain deep insight into the issues and challenges that lie ahead.","Farmer Producer Organisations Frequently Asked Questions (Faqs),7.3 What Is The Benefit From Value Chain Concept? The Benefits May Be In Terms Of Pricing, Both For Input Supply, Output Delivery And Services. In Agricultural Value Chains, Benefits May Come From The Following, Which Would Result In Cost Reduction Or Revenue Maximisation",,,28,input/md/english\FARMER PRODUCER ORGANISATIONS.pdf,para,,
470,,"In short, the business plan must contain answers to the questions  ""Who/What/Where/When/Why/How/How Much"". 7.5 What is business planning?","Farmer Producer Organisations Frequently Asked Questions (Faqs),7.3 What Is The Benefit From Value Chain Concept? The Benefits May Be In Terms Of Pricing, Both For Input Supply, Output Delivery And Services. In Agricultural Value Chains, Benefits May Come From The Following, Which Would Result In Cost Reduction Or Revenue Maximisation",,,18,input/md/english\FARMER PRODUCER ORGANISATIONS.pdf,para,,
471,,"The business planning process starts with Generation of Business Ideas, followed by Opportunities & Threats Analysis leading to Identification of suitable Business Opportunities.","Farmer Producer Organisations Frequently Asked Questions (Faqs),7.3 What Is The Benefit From Value Chain Concept? The Benefits May Be In Terms Of Pricing, Both For Input Supply, Output Delivery And Services. In Agricultural Value Chains, Benefits May Come From The Following, Which Would Result In Cost Reduction Or Revenue Maximisation",,,23,input/md/english\FARMER PRODUCER ORGANISATIONS.pdf,para,,
472,,"Once Business Opportunity is identified, a Marketing Plan is prepared. The final part of the process deals with the Financial Plan.","Farmer Producer Organisations Frequently Asked Questions (Faqs),7.3 What Is The Benefit From Value Chain Concept? The Benefits May Be In Terms Of Pricing, Both For Input Supply, Output Delivery And Services. In Agricultural Value Chains, Benefits May Come From The Following, Which Would Result In Cost Reduction Or Revenue Maximisation",,,21,input/md/english\FARMER PRODUCER ORGANISATIONS.pdf,para,,
473,247.0,## Business Ideas Generation Short-Listing Business Ideas Opportunities/Threats Analysis Business Opportunities Identification & Selection Market Plan Financial Plan,Farmer Producer Organisations Frequently Asked Questions (Faqs),,,18,input/md/english\FARMER PRODUCER ORGANISATIONS.pdf,heading,,
474,248.0,"7.6 Why should a PO prepare a business plan? Every business irrespective of size needs planning. Business planning is essential for growth and sustainability. It provides broad ideas to meet the expected and unexpected opportunities and obstacles the future holds. In case of a PO, it is all the more essential since most of the members will be acting as businessmen for the first time. A business plan helps the PO in the following ways:  a. It helps in examining viability of the venture in a particular market. b. It provides guidance to the PO for organising and planning activities. c. It serves as an important tool in accessing finance/funding. If the financier is  comfortable with the business plan, the PO will be asked to prepare a Detailed Project Report (DPR).","Farmer Producer Organisations Frequently Asked Questions (Faqs),Business Ideas Generation Short-Listing Business Ideas Opportunities/Threats Analysis Business Opportunities Identification & Selection Market Plan Financial Plan",,,131,input/md/english\FARMER PRODUCER ORGANISATIONS.pdf,para,,
475,249.0,## 7.7 What Are The Elements Of A Business Plan? The Business Plan Provides Broad Parameters For Achieving The Goals Of The Po. A Typical Business Plan Will Contain The Following:,Farmer Producer Organisations Frequently Asked Questions (Faqs),,,31,input/md/english\FARMER PRODUCER ORGANISATIONS.pdf,heading,,
476,,a. Executive summary    b. Business Description c. Industry/Sector analysis d. Marketing plan e. Operations plan  f. Financial plan    7.8 What is included in an executive summary?,"Farmer Producer Organisations Frequently Asked Questions (Faqs),7.7 What Are The Elements Of A Business Plan? The Business Plan Provides Broad Parameters For Achieving The Goals Of The Po. A Typical Business Plan Will Contain The Following:",,,26,input/md/english\FARMER PRODUCER ORGANISATIONS.pdf,para,,
477,,The executive summary is an abstract containing the important points of the business plan.,"Farmer Producer Organisations Frequently Asked Questions (Faqs),7.7 What Are The Elements Of A Business Plan? The Business Plan Provides Broad Parameters For Achieving The Goals Of The Po. A Typical Business Plan Will Contain The Following:",,,14,input/md/english\FARMER PRODUCER ORGANISATIONS.pdf,para,,
478,,"Its purpose is to communicate the plan in a convincing way to important audiences, such as potential investors, so they will read further.","Farmer Producer Organisations Frequently Asked Questions (Faqs),7.7 What Are The Elements Of A Business Plan? The Business Plan Provides Broad Parameters For Achieving The Goals Of The Po. A Typical Business Plan Will Contain The Following:",,,23,input/md/english\FARMER PRODUCER ORGANISATIONS.pdf,para,,
479,,"It may be the only chapter of the business plan a reader uses to make a quick decision on the proposal. As such, it should fulfill the reader's (financier's) expectations.","Farmer Producer Organisations Frequently Asked Questions (Faqs),7.7 What Are The Elements Of A Business Plan? The Business Plan Provides Broad Parameters For Achieving The Goals Of The Po. A Typical Business Plan Will Contain The Following:",,,30,input/md/english\FARMER PRODUCER ORGANISATIONS.pdf,para,,
